,ID,Date,Username,Title,Content,Upvotes
0,plqzal,2021-09-10,CrocodileLoki,All that it's missing is a Bloomberg terminal and an MD standing above,,3
1,plolx1,2021-09-10,send_et_back,TSMC,"Why is no one watching/buying TSMC..entire ask is empty there..literally no one wants to sell...all Nvida, amd, apple and intel is outsourcing chip manufacturing to them..they have also raised up advanced node prices by 20%..literally no one can match capacity/pricing for adnavced nodes to TSMC level..margin expansion coming next year..one of the best bets out there.",2
2,plohfk,2021-09-10,AppyWappy,The Short-Squeeze Corruption,"This sub hates short-sellers, in fact, it could probably claim credit for that mania that has now spread to hedge funds. Let's face it, the recent squeezes have been products of hedge funds, not retail investors. To that end, think of Nikola, an admittedly fraudulent company whose founder and CEO is facing a criminal trial. It still has a market cap of over $3 billion likely due to hedge funds trying to squeeze short-sellers. Obviously, the efficient market hypothesis is a lie, this is all a scam and a casino, but if there is anything left of your objective minds, doesn't it feel a bit gross that $3 billion dollars that could be working somewhere else in the economy is tied up in this fraud? The short-sellers are the most moral players in this madness.",2
3,plqmmi,2021-09-10,nirvana6789,🍄 Loss porn,,2
4,plp410,2021-09-10,WSB_to_FIRE,10/15 URA $30 Calls - Letting It Ride…who’s with me??!,,2
5,plqsbg,2021-09-10,Exit-Zero_SouthJ,Is this a sign for AMC?,,2
6,plocvt,2021-09-10,Zachisawinner,She’s dead Jim,,2
7,ploj9i,2021-09-10,TeslaNioBull,Can I get some prayers?? I’m retarded as f*ck :(,,2
8,pli7rh,2021-09-10,VicRok,"On $TLRL's daily chart, possible long-term descending triangle forming since the end of January. With quarterly earnings approaching next month, added articles in the news almost daily about legalization and the hope of people buying the rumor and selling the news. Buy and hold Apes!!!!🚀🧨🚀$💵",,2
9,plv6hx,2021-09-10,Deebado,"When the root is deep, there is no reason to fear the wind!",,2
10,plhp3h,2021-09-10,gezyy1008,smh,,1
11,plyfm4,2021-09-11,chandu102296,The #1 AMM Decentralized Exchange for Cannabis tokenized stocks!,[removed],1
12,plym5v,2021-09-11,YoloFund888,Podcast Interview: New Company Founded by 'Godfather of Cannabis' Bringing Synthetic CBD Analog to Clinical Trial,[removed],1
13,plow59,2021-09-10,Straight_Argument365,Film or not!!!,[removed],1
14,plravt,2021-09-10,stxsr1ly,Please help me find this website that showed in-flow and out-flow of money in a pie chart and it had institutional investors on a bar chart!,[removed],1
15,plr8r5,2021-09-10,Mr21guy-yt,Hi I’m new to investing is anyone able to message me and give me tips and how things work in the investing world?,[removed],1
16,plzfn6,2021-09-11,PuzzledMindAndBody,Broker for both Recurring &amp; Fractional Investing,[removed],1
17,plzkmg,2021-09-11,DarkEnforcer911,Thoughts on isee stock,[removed],1
18,plv42w,2021-09-10,Intelligent-Command9,I have no clue what i’m doing,[removed],1
19,plwxw4,2021-09-11,mainstcollective,PetroSun Energy (PSUD) has been on the rise and may be gearing up for another uptick,[removed],1
20,plx7bz,2021-09-11,No-Court357,Beginner - Need Help,[removed],1
21,plx7vl,2021-09-11,CapBrwnBeard,When picking stocks….,[removed],1
22,plxl5r,2021-09-11,spader6,abbvie scares…,[removed],1
23,ply8ta,2021-09-11,Mynameistowelie,"Lookinh for potential high growth, small-cap stocks under $50 share price with strong fundamentals.","Mine is currently WELL Health up 7,000% since IPO. 

Average cost was .92c it’s now sitting at $7.98 CAD at a dip from a high of $8.25C earlier this week.

Good quality of management with previous successful business, business model focuses on aggressive acquisition. 

Fundamentals are strong in that it has twice as much cash on hand to cover all liabilities not considering total assets. 

I strongly believe Digital health will be the future of the healthcare industry just as hoe online banking became inevitable. 

The pandemic has also provided this industry and sector as a strong catalyst for the need for more virtual medical care. 

They also own many in-person health care business as well. 

Revenue and EBIDTA increasing exponentially year over year. 

Looking for companies similar to this in different industries and sectors.",1
24,pm03h3,2021-09-11,transneptuneobj,This is not due diligence but I need hekp.,"I need help from anyone that lives in a heavy red state,  what stores sell office supplies in your area. With the impending protests this seems like an opertunitt to monetize republican rage that I cannot pass up.",1
